{
  "blockers": [
    "EXTERNAL 잔여: OTLP collector, 물리 holdout+독립 승인자, OPENAI key, 통계 모집단, codex 플랜 모델, claude OAuth 토큰(사용자 발급)."
  ],
  "completed_slices": [
    "S01",
    "S02",
    "S03",
    "S04",
    "S05",
    "S06",
    "S07"
  ],
  "context_pack_hash": "926c581ab638e9473302f0f146d9aa3b94ee8830d332f85db903f24ff961433e",
  "current_slice": null,
  "git_checkpoint": "fa2772febf13a4f3c5b99f995e75eafa89aae53a",
  "last_verification": {
    "check_count": 0,
    "environment": {},
    "exit_code": null,
    "failed_checks": [],
    "profile": "fast",
    "source": ".specify/eval/last.json",
    "verdict": "PASS"
  },
  "next_action": "사용자: (1) `claude setup-token` 을 실행해 구독 OAuth 토큰을 만들고 ~/.config/amplai/claude-oauth.env 에 CLAUDE_CODE_OAUTH_TOKEN=... 로 저장하면 scripts/requalify_drivers.py 로 claude-cli 자격을 재측정한다. (2) codex TUI 에서 실제로 쓰는 모델명을 알려주면 REQUALIFY_CODEX_MODEL 로 재시도한다. 컨테이너: scripts/sandbox_up.sh --status / --down; 테스트는 pytest -m container. 후속: podman 에서 --init 확인, 컨테이너 안에서 실제 claude 턴(토큰 필요), amplai ops cutover 명령.",
  "open_slices": [],
  "schema_version": "1.0",
  "status": "done",
  "work_id": "AMPLAI-V3-RC03"
}
