{
  "blockers": [],
  "completed_slices": [],
  "context_pack_hash": "a064c47d20de95f5b093d2b47c485d1da38a06fbf7609fd1b60fe6e165571eb9",
  "current_slice": null,
  "git_checkpoint": "8d94da46f4d66486bbe28d5751f904b50f2f16d9",
  "last_verification": null,
  "next_action": "Actions 가 복구되면 main 에서 CI 를 한 번 돌린다. PR #2 의 41 commit 은 CI 로 확인된 적이 없다.",
  "open_slices": [],
  "schema_version": "1.0",
  "status": "done",
  "work_id": "ALR-007"
}
