{
  "blockers": [],
  "completed_slices": [],
  "context_pack_hash": "3daa7a7a1a9c567900258921e5220d243014ed9af7200954c1c1ac753e8c6f4a",
  "current_slice": null,
  "git_checkpoint": "f61ca1cf95f99ec7d1fa914013046a85d9c1e4e0",
  "last_verification": null,
  "next_action": "commit 승인을 받는다. 그 다음 MGC-012 Package 5 round 17 — wave 10(T031~T034) review, 재freeze 부터",
  "open_slices": [],
  "schema_version": "1.0",
  "status": "executing",
  "work_id": "ALR-003"
}
